{
  "$schema": "https://json-schema.org/draft/2020-12/schema",
  "$id": "https://media-monitor/contracts/news_article_draft.v1.json",
  "title": "news_article_draft.v1",
  "description": "Editorial written draft generated from a brief.",
  "type": "object",
  "additionalProperties": false,
  "properties": {
    "schema_name": { "const": "news_article_draft.v1" },
    "schema_status": { "const": "experimental_structured" },
    "draft_id": { "type": "string", "minLength": 1 },
    "digest_at": {
      "type": "string",
      "pattern": "^[0-9]{8}T[0-9]{2}$"
    },
    "story_group_id": { "type": "string", "minLength": 1 },
    "brief_id": { "type": "string", "minLength": 1 },
    "title": { "type": "string", "minLength": 1 },
    "slug_candidate": { "type": "string", "minLength": 1 },
    "summary": { "type": "string", "minLength": 1 },
    "dek": { "type": "string", "minLength": 1 },
    "lede": { "type": "string", "minLength": 1 },
    "sections": {
      "type": "array",
      "minItems": 1,
      "items": {
        "type": "object",
        "additionalProperties": false,
        "properties": {
          "section_id": { "type": "string", "minLength": 1 },
          "heading": { "type": "string", "minLength": 1 },
          "summary": { "type": "string", "minLength": 1 }
        },
        "required": ["section_id", "heading", "summary"]
      }
    },
    "body_md": { "type": "string", "minLength": 1 },
    "body_markdown": { "type": "string", "minLength": 1 },
    "source_links": {
      "type": "array",
      "minItems": 1,
      "items": { "type": "string", "format": "uri" }
    },
    "source_ids": {
      "type": "array",
      "minItems": 1,
      "items": { "type": "string", "minLength": 1 }
    },
    "topic": { "type": "string", "minLength": 1 },
    "status": { "const": "draft" },
    "created_at": { "type": "string", "format": "date-time" },
    "citations": {
      "type": "array",
      "items": {
        "type": "object",
        "additionalProperties": false,
        "properties": {
          "citation_id": { "type": "string", "minLength": 1 },
          "claim_text": { "type": "string", "minLength": 1 },
          "source_ref_id": { "type": "string", "minLength": 1 },
          "url": { "type": "string", "format": "uri" }
        },
        "required": ["citation_id", "claim_text", "source_ref_id", "url"]
      }
    },
    "fact_check_flags": {
      "type": "array",
      "items": {
        "type": "object",
        "additionalProperties": false,
        "properties": {
          "flag": { "type": "string", "minLength": 1 },
          "severity": { "type": "string", "enum": ["low", "medium", "high"] },
          "note": { "type": "string", "minLength": 1 }
        },
        "required": ["flag", "severity", "note"]
      }
    },
    "revision_notes": {
      "type": "array",
      "items": { "type": "string", "minLength": 1 }
    }
  },
  "required": [
    "schema_name",
    "schema_status",
    "draft_id",
    "digest_at",
    "story_group_id",
    "brief_id",
    "title",
    "slug_candidate",
    "summary",
    "dek",
    "lede",
    "sections",
    "body_md",
    "body_markdown",
    "source_links",
    "source_ids",
    "topic",
    "status",
    "created_at",
    "citations",
    "fact_check_flags",
    "revision_notes"
  ]
}
